{
  "arn": "arn:aws:devicefarm:us-west-2:123456789012:project:abc123",
  "name": "Example name",
  "type": "BUILTIN_FUZZ",
  "platform": "ANDROID",
  "created": "example-created",
  "status": "COMPLETED",
  "result": "PASSED",
  "started": "example-started",
  "stopped": "example-stopped",
  "counters": "example-counters",
  "message": "An example message",
  "totalJobs": "example-totalJobs",
  "completedJobs": "example-completedJobs",
  "billingMethod": "example-billingMethod",
  "deviceMinutes": "example-deviceMinutes",
  "networkProfile": "example-networkProfile",
  "parsingResultUrl": "https://example.com/resource",
  "resultCode": "PASSED",
  "seed": "example-seed",
  "appUpload": "example-appUpload",
  "eventCount": "example-eventCount",
  "jobTimeoutMinutes": "example-jobTimeoutMinut",
  "devicePoolArn": "arn:aws:devicefarm:us-west-2:123456789012:project:abc123",
  "locale": "example-locale",
  "radios": "example-radios",
  "location": "example-location",
  "customerArtifactPaths": "example-customerArtifac",
  "webUrl": "https://example.com/resource",
  "skipAppResign": "example-skipAppResign",
  "testSpecArn": "arn:aws:devicefarm:us-west-2:123456789012:project:abc123",
  "deviceSelectionResult": "PASSED",
  "vpcConfig": "example-vpcConfig"
}